Timestamp,Title,URL/DOI (please check DOI by collating DOI at the end of https://doi.org/  ),Provider/Creators,Material Type (see: https://help.oercommons.org/support/solutions/articles/42000046908-material-types for Glossary of terms),Education Level,Abstract,Language,Conditions of Use,Primary User,Subject Areas,FORRT Clusters  | see: https://forrt.org/clusters,"User Tags (separate by comma if more than one; capitalize each word, except for prepositions)"
2020-05-06T14:52:48.000Z,Replication and Open Science for Undergraduates,https://funderstorms.wordpress.com/2018/05/10/replication-and-open-science-for-undergraduates/,David Funder,Reading,"College / Upper Division (Undergraduates), Graduate / Professional",Blog post going over the replication crisis and how it has led to the open science movement.,English,I don't see any of these,"Student, Teacher","Applied Science, Life Science, Math & Statistics, Social Science",,"Blog,Open Science,Reproducibility Crisis and Credibility Revolution"
10/7/2020 16:08:25,Course materials,https://www.projecttier.org/tier-classroom/course-materials/,Project Tier,"Module, Syllabus",College / Upper Division (Undergraduates),"Learn about courses, in a wide range of fields at a variety of institutions, where principles and resources from Project TIER have been used to teach transparent research methods.",English,I don't see any of these,Student,"Applied Science, Math & Statistics, Social Science","Reproducibility and Replicability Knowledge, Conceptual and Statistical Knowledge",Reproducibility Crisis and Credibility Revolution; Open Science; Conceptual and statistical knowledge
10/12/2020 12:58:25,Data Management and Data Sharing in Psychological Science: Revision of the DGPs Recommendations,https://psyarxiv.com/24ncs/,"Mario Gollwitzer, Andrea Abele-Brehm, Christian Fiebach, Roland Ramthun, Anne Scheel, Felix Schönbrodt, Ulf Steinberg",Reading,College / Upper Division (Undergraduates),"Providing access to research data collected as part of scientific publications and publicly funded research projects is now regarded as a central aspect of an open and transparent scientific practice and is increasingly being called for by funding institutions and scientific journals. To this end, researchers should strive to comply with the so-called FAIR principles (of scientific data management), that is, research data should be findable, accessible, interoperable, and reusable. Systematic data management supports these goals and, at the same time, makes it possible to achieve them efficiently. With these revised recommendations on data management and data sharing, which also draw on feedback from a 2018 survey of its members, the German Psychological Society (Deutsche Gesellschaft für Psychologie; DGPs) specifies important basic principles of data management in psychology. Initially, based on discipline-specific definitions of raw data, primary data, secondary data, and metadata, we provide recommendations on the degree of data processing necessary when publishing data. We then discuss data protection as well as aspects of copyright and data usage before defining the qualitative requirements for trustworthy research data repositories. This is followed by a detailed discussion of pragmatic aspects of data sharing, such as the differences between Type 1 and Type 2 data publications, restrictions on use (embargo period), the definition of ""scientific use"" by secondary users of shared data, and recommendations on how to resolve potential disputes. Particularly noteworthy is the new recommendation of distinct ""access categories"" for data, each with different requirements in terms of data protection or research ethics. These range from completely open data without usage restrictions (""access category 0"") to data shared under a set of standardized conditions (e.g., reuse restricted to scientific purposes; ""access category 1""), individualized usage agreements (""access category 2""), and secure data access under strictly controlled conditions (e.g., in a research data center; “access category 3""). The practical implementation of this important innovation, however, will require data repositories to provide the necessary technical functionalities. In summary, the revised recommendations aim to present pragmatic guidelines for researchers to handle psychological research data in an open and transparent manner, while addressing structural challenges to data sharing solutions that are beneficial for all involved parties.",English,CC BY,Student,Social Science,Open Data and Materials,Open data
10/13/2020 9:15:36,Teaching replicable and reproducible science,https://osf.io/x7d45/,Kirsten Lane et al.,"Module, Teaching/Learning Strategy","College / Upper Division (Undergraduates), Graduate / Professional","Participants will develop materials for teaching replicability and reproducible science. Possible materials to be generated include syllabi, specific assignments, or single lectures or lesson plans. We will provide existing teaching materials and structured activities designed to help participants define learning goals, develop teaching resources to facilitate those goals, and to create appropriate learning assessments.",English,I don't see any of these,Teacher,Social Science,Conceptual and Statistical Knowledge,Teaching
10/16/2020 6:20:13,CREP tutorials,https://www.youtube.com/playlist?list=PLECcejm-vUj-kOyCGXxN2TeAFTRFj1HU1,Dr Jordan Wagge,Videos,College / Upper Division (Undergraduates),This playlist was created to help students and their instructors complete CREP projects.,English,I don't see any of these,"Student, Teacher","Applied Science, Social Science","Reproducibility and Replicability Knowledge, Replication Research",Reproducibility and replicability
10/16/2020 6:22:33,"Open Research:  Examples of good practice, and resources across disciplines",https://docs.google.com/document/d/1Vblnwym18kX2tmL3VcooSdN1CLg3xkppARGCGB39lvw/edit,"Emily K Farran, Priya Silverstein, Camilla Gilmore",Reading,"College / Upper Division (Undergraduates), Adult Education","This is a document about open science across disciplines, together with resources to these disciplines.",English,I don't see any of these,"Student, Teacher","Applied Science, Social Science",Open Data and Materials,Open science
10/17/2020 17:43:27,The p-value misconception eradication challenge,http://daniellakens.blogspot.com/2020/10/the-p-value-misconception-eradication.html,Daniel Lakens,Reading,College / Upper Division (Undergraduates),"If you have educational material that you think will do a better job at preventing p-value misconceptions than the material in my MOOC, join the p-value misconception eradication challenge by proposing an improvement to my current material in a new A/B test in my MOOC.",English,I don't see any of these,"Student, Teacher","Applied Science, Math & Statistics, Social Science",Conceptual and Statistical Knowledge,Teaching
10/20/2020 8:05:06,Managing Qualitative Social Science Data,https://managing-qualitative-data.org/,Anon,"Interactive, Lesson, Module",College / Upper Division (Undergraduates),A website with modules and lessons on qualitative research and data management,English,I don't see any of these,Student,"Applied Science, Social Science",Reproducibility and Replicability Knowledge,Qualitative research
10/24/2020 9:10:15,Taking stock of the credibility revolution: Scientific reform 2011-no,https://doi.org/10.13140/RG.2.2.21721.47200/1,Gilad Feldman,Reading,"College / Upper Division (Undergraduates), Graduate / Professional",A book about the credibility revolution,English,I don't see any of these,"Student, Teacher","Applied Science, Social Science","Reproducibility and Replicability Knowledge, Reproducible Analyses, Replication Research",Credibility revolution
10/25/2020 3:00:22,Science Literacy,https://www.coursera.org/learn/science-literacy,University of Alberta,Full Course,"College / Upper Division (Undergraduates), Graduate / Professional, Adult Education","Fake news or good science? In a world where we have access to unlimited information, it is hard to sift through the echo chamber of opinions fueled by emotions and personal biases, rather than scientific evidence. Science Literacy will teach you about the process of science, how to think critically, how to differentiate science from pseudoscience, how indigenous wisdom can inform science, how to understand and design a scientific study, and how to critically evaluate scientific communication in the media. Every module will build your new skill-base with real life examples, and at the end of each module you will have to apply these skills to scientific questions, talking points and controversies in the world. Warning: this course requires an open mind and the ability to self-reflect.",English,I don't see any of these,"Student, Parent, Laypeople","Applied Science, Social Science",Conceptual and Statistical Knowledge,Scientific communication
10/25/2020 18:58:28,"Free and low cost resources for graduate  students, postdocs, and early career researchers  (or really anyone else)",https://docs.google.com/document/d/1IFbHIN5OOAO0qz-VfCU9nEx4-x6CfArj1-d8ylA2vsU/edit,Dr Jaclyn Siegel,"Reading, Resource list","College / Upper Division (Undergraduates), Graduate / Professional",A list of free or cheap resources (e.g. free and open statistical software) that support the processes of science ,English,I don't see any of these,"Student, Teacher, Librarian, Early career researchers","Applied Science, Social Science",Open Data and Materials,Open science
10/28/2020 8:00:56,Preregistration for Quantitative Research in Psychology Template,https://docs.google.com/spreadsheets/d/1vlp5GN-HXrtrjCdjE28f_3tT6RiwhQO2vVeOZGOaFsQ/edit#gid=0,Pre-registration standards for psychology,Reading,College / Upper Division (Undergraduates),A template to use for pre-registration,English,I don't see any of these,"Student, Teacher","Applied Science, Social Science",Preregistration,Transparency
10/28/2020 13:19:48,Credibility of preprints: an interdisciplinary survey of researchers,https://doi.org/10.1098/rsos.201520,Courtney K. Soderberg et al.,Reading,"College / Upper Division (Undergraduates), Graduate / Professional","Preprints increase accessibility and can speed scholarly communication if researchers view them as credible enough to read and use. Preprint services do not provide the heuristic cues of a journal's reputation, selection, and peer-review processes that, regardless of their flaws, are often used as a guide for deciding what to read. We conducted a survey of 3759 researchers across a wide range of disciplines to determine the importance of different cues for assessing the credibility of individual preprints and preprint services. We found that cues related to information about open science content and independent verification of author claims were rated as highly important for judging preprint credibility, and peer views and author information were rated as less important. As of early 2020, very few preprint services display any of the most important cues. By adding such cues, services may be able to help researchers better assess the credibility of preprints, enabling scholars to more confidently use preprints, thereby accelerating scientific communication and discovery.",English,I don't see any of these,"Student, Teacher",Social Science,"Reproducibility and Replicability Knowledge, Reproducible Analyses, Open Data and Materials, Replication Research",Preprints
10/29/2020 12:40:49,Data tutorial: Power analysis using G*Power,https://www.youtube.com/watch?v=5J4IKzDfT0w&feature=youtu.be,Andrew Livingstone,Video,"College / Upper Division (Undergraduates), Graduate / Professional",A tutorial on a priori and sensitivity power analyses using G*power,English,I don't see any of these,Student,"Applied Science, Social Science",Conceptual and Statistical Knowledge,Power analysis
10/29/2020 13:08:48,RIOT science club,https://www.youtube.com/c/RIOTScienceClub/videos,RIOT,Video,"College / Upper Division (Undergraduates), Graduate / Professional",A videos that discusses world-leading open science,English,I don't see any of these,"Student, Teacher, Librarian","Applied Science, Social Science","Reproducibility and Replicability Knowledge, Conceptual and Statistical Knowledge, Reproducible Analyses, Preregistration, Open Data and Materials, Replication Research",Open science
10/29/2020 13:10:26,"Rethinking Research Assessment:Addressing Institutional Biases in Review, Promotion, and Tenure Decision-Making (part IV)",https://theplosblog.plos.org/2020/10/rethinking-research-assessmentaddressing-institutional-biases-in-review-promotion-and-tenure-decision-making-part-iv/,Ruth Schmidt,Reading,"College / Upper Division (Undergraduates), Graduate / Professional",In our final installment we get into how incumbent processes and perceptions have the advantage.,English,I don't see any of these,"Student, Teacher","Applied Science, Social Science",Academic Life and Culture,"Diversity, Equity and Inclusion"
10/31/2020 13:16:26,Open Science Saves Lives: Lessons from the COVID-19 Pandemic,https://www.biorxiv.org/content/10.1101/2020.08.13.249847v2,Lonni Besançon et al. ,Reading,"College / Upper Division (Undergraduates), Graduate / Professional, Adult Education","In the last decade Open Science principles, such as Open Access, study preregistration, use of preprints, making available data and code, and open peer review, have been successfully advocated for and are being slowly adopted in many different research communities. In response to the COVID-19 pandemic many publishers and researchers have sped up their adoption of some of these Open Science practices, sometimes embracing them fully and sometimes partially or in a sub-optimal manner. In this article, we express concerns about the violation of some of the Open Science principles and its potential impact on the quality of research output. We provide evidence of the misuses of these principles at different stages of the scientific process. We call for a wider adoption of Open Science practices in the hope that this work will encourage a broader endorsement of Open Science principles and serve as a reminder that science should always be a rigorous process, reliable and transparent, especially in the context of a pandemic where research findings are being translated into practice even more rapidly. We provide all data and scripts at https://osf.io/renxy/.",English,I don't see any of these,"Student, Teacher, Policy maker","Applied Science, Life Science, Social Science","Reproducibility and Replicability Knowledge, Reproducible Analyses, Open Data and Materials, Replication Research",Open science
10/31/2020 13:19:10,Race to the Bottom: Competition and Quality in Science,http://economics.mit.edu/files/20679,Ryan Hill and Caroline Stein,Reading,College / Upper Division (Undergraduates),"This paper investigates how competition to publish first and thereby establish priority impacts the quality of scientific research. We begin by developing a model where scientists decide whether and how long to work on a given project. When deciding how long to let their projects mature, scientists trade off the marginal benefit of higher quality research against the marginal risk of being preempted. The most important (highest potential) projects are the most competitive because they induce the most entry. Therefore, the model predicts these projects are also the most rushed and lowest quality. We test the predictions of this model in the field of structural biology using data from the Protein Data Bank (PDB), a repository for structures of large macromolecules. An important feature of the PDB is that it assigns objective measures of scientific quality to each structure. As suggested by the model, we find that structures with higher ex-ante potential generate more competition, are completed faster, and are lower quality. Consistent with the model, and with a causal interpretation of our empirical results, these relationships are mitigated when we focus on structures deposited by scientists who – by nature of their employment position – are less focused on publication and priority.",English,I don't see any of these,Student,"Applied Science, Life Science, Social Science","Reproducibility and Replicability Knowledge, Academic Life and Culture","Publish or perish culture, Quality of publication"
10/31/2020 13:20:41,"Crisis research, fast and slow",http://www.the100.ci/2020/03/26/crisis-research-fast-and-slow/,Anna Scheel,Reading,College / Upper Division (Undergraduates),A blog about the crisis of research,English,I don't see any of these,Student,"Applied Science, Social Science",Open Data and Materials,Open science
11/2/2020 11:13:04,Towards inclusive funding practices for early career researchers,https://osf.io/9sfm8/,Charlotte de Winde,Reading,College / Upper Division (Undergraduates),"Securing research funding is a challenge faced by most scientists in academic institutions worldwide. Funding success rates for all career stages are low, but the burden falls most heavily on early career researchers (ECRs) - young investigators in training and new principal investigators - who have a shorter track record and are dependent on funding to establish their academic career. The low number of career development awards and the lack of sustained research funding results in the loss of ECR talent in academia. Several steps in the current funding process, from grant conditions to the review process, play significant roles in the distribution of funds. Furthermore, there is an imbalance among certain research disciplines and labs of influential researchers that receive more funding. As a group of ECRs with global representation, we examined funding practices, barriers, facilitators, and alternatives to the current funding systems to diversify risk or award grants on a partly random basis. Based on our discussions, research, and collective opinions, we detail recommendations for funding agencies and grant reviewers to improve ECR funding prospects worldwide and promote a fairer and more inclusive funding landscape for ECRs.",English,I don't see any of these,Student,"Applied Science, Social Science",Academic Life and Culture,Funding
11/19/2020 12:37:56,Data management,https://www.youtube.com/playlist?list=PLy1c0eubiYXlBLTk4T_i-IQGopzSWfSuj,UARK PsychStats,Video,College / Upper Division (Undergraduates),Videos that provide information on data management,English,I don't see any of these,Student,"Applied Science, Life Science, Social Science",Reproducibility and Replicability Knowledge,Data management
11/21/2020 7:16:27,Bayesian Cognitive Modelling,https://bayesmodels.com/,Michael Lee and Eric-Jan Wagenmakers,Reading,College / Upper Division (Undergraduates),"This site is dedicated to the book “Bayesian Cognitive Modeling: A Practical Course”, published by Cambridge University Press.",English,I don't see any of these,Student,Math & Statistics,Conceptual and Statistical Knowledge,Bayesian statistics
11/21/2020 7:20:31,A. Solomon Kurz website,https://solomonkurz.netlify.app/post/,A.Solomon Kurz,Reading,College / Upper Division (Undergraduates),A blog posts about Bayesian statistics,English,I don't see any of these,Student,Math & Statistics,Conceptual and Statistical Knowledge,Bayesian statistics
11/21/2020 7:21:40,Richard McElreath,https://www.youtube.com/channel/UCNJK6_DZvcMqNSzQdEkzvzA/videos,Richard McElreath,Videos,College / Upper Division (Undergraduates),A series of youtube videos about his book on statistical rethinking and Bayesian statistics,English,I don't see any of these,"Student, Teacher",Math & Statistics,Conceptual and Statistical Knowledge,Bayesian statistics
11/21/2020 7:24:19,Bayes Rules! An Introduction to Bayesian Modelling in R,https://www.bayesrulesbook.com/,"Alicia A. Johnson, Miles Ott, Mine Dogucu",Reading,College / Upper Division (Undergraduates),"Bayesian statistics?! Once an obscure term outside specialized industry and research circles, Bayesian methods are enjoying a renaissance. The title of this book speaks to what all the fuss is about: Bayes rules! Bayesian methods provide a powerful alternative to the frequentist methods that are ingrained in the standard statistics curriculum. Though frequentist and Bayesian methods share a common goal – learning from data – the Bayesian approach to this goal is gaining popularity for many reasons: (1) Bayesian methods allow us to interpret new data in light of prior information, formally weaving both into a set of updated information; (2) relative to the confidence intervals and p-values utilized in frequentist analyses, Bayesian results are easier to interpret; (3) Bayesian methods can shine in settings where frequentist “likelihood” methods break down; and (4) the computational tools required for applying Bayesian techniques are increasingly accessible. Unfortunately, the popularity of Bayesian statistics has outpaced the curricular resources needed to support it. To this end, the primary goal of Bayes Rules! is to make modern Bayesian thinking, modeling, and computing accessible to a broad audience.",English,I don't see any of these,"Student, Teacher",Math & Statistics,Conceptual and Statistical Knowledge,Bayesian statistics
12/3/2020 12:59:00,Online Experiments for Language Scientists,https://kennysmithed.github.io/oels2020/,Kenny Smith,Syllabus,College / Upper Division (Undergraduates),"Many areas in the language sciences rely on collecting data from human participants, from grammaticality judgments to behavioural responses (key presses, mouse clicks, spoken responses). While data collection traditionally takes place face-to-face, recent years have seen an explosion in the use of online data collection: participants take part remotely, providing responses through a survey tool or custom experimental software running in their web browser, with surveys or experiments often being advertised on crowdsourcing websites like Amazon Mechanical Turk (MTurk) or Prolific. Online methods potentially allow rapid and low-effort collection of large samples, and are particularly useful in situations where face-to-face data collection is not possible (e.g. during a pandemic); however, building and running these experiments poses challenges that differ from lab-based methods.

This course will provide a rapid tour of online experimental methods in the language sciences, covering a range of paradigms, from survey-like responses (e.g. as required for grammaticality judgments) through more standard psycholinguistic methods (button presses, mouse clicks) up to more ambitious and challenging techniques (e.g. voice recording, real-time interaction through text and/or streaming audio, iterated learning). Each week we will read a paper detailing a study using online methods, and look at code (written in javascript using jspsych) to implement a similar experiment - the examples will skew towards the topics I am interested in (language learning, communication, language evolution), but we’ll cover more standard paradigms too (grammaticality judgments, self-paced reading) and the techniques are fairly general anyway. We’ll also look at the main platforms for reaching paid participants, e.g. MTurk and Prolific, and discuss some of the challenges around data quality and the ethics of running on those platforms.

No prior experience in coding is assumed, but you have to be prepared to dive in and try things out; the assessment will involve elements of both literature review and coding.",English,CC BY,"Student, Teacher, Researchers",Social Science,Open Data and Materials,Programming
12/5/2020 13:47:07,GGPlot Colors Best Tricks You Will Love,https://www.datanovia.com/en/blog/ggplot-colors-best-tricks-you-will-love/,Alboukadel,Reading,College / Upper Division (Undergraduates),This article presents multiple great solutions you should know for changing ggplot colors.,English,I don't see any of these,Student,"Math & Statistics, Social Science",Conceptual and Statistical Knowledge,Data visualisation
