2020-06-05T19:09:54.895Z,A Software Tool for Removing Patient Identifying Information from Clinical Documents,https://doi.org/10.1197/jamia.M2702,"Friedlin, F. J., & McDonald, C. J.","Primary Source, Reading, Paper",College / Upper Division (Undergraduates),"We created a software tool that accurately removes all patient identifying information from various kinds of clinical data documents, including laboratory and narrative reports. We created the Medical De-identification System (MeDS), a software tool that de-identifies clinical documents, and performed 2 evaluations. Our first evaluation used 2,400 Health Level Seven (HL7) messages from 10 different HL7 message producers. After modifying the software based on the results of this first evaluation, we performed a second evaluation using 7,190 pathology report HL7 messages. We compared the results of MeDS de-identification process to a gold standard of human review to find identifying strings. For both evaluations, we calculated the number of successful scrubs, missed identifiers, and over-scrubs committed by MeDS and evaluated the readability and interpretability of the scrubbed messages. We categorized all missed identifiers into 3 groups: (1) complete HIPAA-specified identifiers, (2) HIPAA-specified identifier fragments, (3) non-HIPAA–specified identifiers (such as provider names and addresses). In the results of the first-pass evaluation, MeDS scrubbed 11,273 (99.06%) of the 11,380 HIPAA-specified identifiers and 38,095 (98.26%) of the 38,768 non-HIPAA–specified identifiers. In our second evaluation (status postmodification to the software), MeDS scrubbed 79,993 (99.47%) of the 80,418 HIPAA-specified identifiers and 12,689 (96.93%) of the 13,091 non-HIPAA–specified identifiers. Approximately 95% of scrubbed messages were both readable and interpretable. We conclude that MeDS successfully de-identified a wide range of medical documents from numerous sources and creates scrubbed reports that retain their interpretability, thereby maintaining their usefulness for research.",English,I don't see any of these,Student,"Applied Science, Social Science","Reproducible Analyses,Open Data and Materials",
2020-06-05T19:12:53.512Z,Making replication mainstream,https://doi.org/10.1017/S0140525X17001972,"Rolf A. Zwaan, Alexander Etz Richard E. Lucas and M. Brent Donnellan","Primary Source, Reading, Paper",College / Upper Division (Undergraduates),"Many philosophers of science and methodologists have argued that the ability to repeat studies and obtain similar results is an essential component of science. A finding is elevated from single observation to scientific evidence when the procedures that were used to obtain it can be reproduced and the finding itself can be replicated. Recent replication attempts show that some high profile results – most notably in psychology, but in many other disciplines as well – cannot be replicated consistently. These replication attempts have generated a considerable amount of controversy, and the issue of whether direct replications have value has, in particular, proven to be contentious. However, much of this discussion has occurred in published commentaries and social media outlets, resulting in a fragmented discourse. To address the need for an integrative summary, we review various types of replication studies and then discuss the most commonly voiced concerns about direct replication. We provide detailed responses to these concerns and consider different statistical ways to evaluate replications. We conclude there are no theoretical or statistical obstacles to making direct replication a routine aspect of psychological science.",English,I don't see any of these,Student,"Applied Science, Social Science","Reproducibility and Replicability Knowledge,Replication Research","Reproducibility Crisis and Credibility Revolution,Open Science"
2020-06-05T19:13:59.055Z,Expectations for Replications: Are Yours Realistic?,https://doi.org/10.1177/1745691614528518,"David J Stanley 1, Jeffrey R Spence","Primary Source, Reading, Paper",College / Upper Division (Undergraduates),"Failures to replicate published psychological research findings have contributed to a ""crisis of confidence."" Several reasons for these failures have been proposed, the most notable being questionable research practices and data fraud. We examine replication from a different perspective and illustrate that current intuitive expectations for replication are unreasonable. We used computer simulations to create thousands of ideal replications, with the same participants, wherein the only difference across replications was random measurement error. In the first set of simulations, study results differed substantially across replications as a result of measurement error alone. This raises questions about how researchers should interpret failed replication attempts, given the large impact that even modest amounts of measurement error can have on observed associations. In the second set of simulations, we illustrated the difficulties that researchers face when trying to interpret and replicate a published finding. We also assessed the relative importance of both sampling error and measurement error in producing variability in replications. Conventionally, replication attempts are viewed through the lens of verifying or falsifying published findings. We suggest that this is a flawed perspective and that researchers should adjust their expectations concerning replications and shift to a meta-analytic mind-set.",English,I don't see any of these,Student,"Applied Science, Social Science","Reproducibility and Replicability Knowledge,Replication Research","Reproducibility Crisis and Credibility Revolution,Open Science"
2020-06-05T19:16:04.774Z,‘‘Positive’’ Results Increase Down the Hierarchy of the Sciences,https://doi.org/10.1371/journal.pone.0010068,Daniele Fanelli,"Primary Source, Reading, Paper",College / Upper Division (Undergraduates),"The hypothesis of a Hierarchy of the Sciences with physical sciences at the top, social sciences at the bottom, and biological sciences in-between is nearly 200 years old. This order is intuitive and reflected in many features of academic life, but whether it reflects the “hardness” of scientific research—i.e., the extent to which research questions and results are determined by data and theories as opposed to non-cognitive factors—is controversial. This study analysed 2434 papers published in all disciplines and that declared to have tested a hypothesis. It was determined how many papers reported a “positive” (full or partial) or “negative” support for the tested hypothesis. If the hierarchy hypothesis is correct, then researchers in “softer” sciences should have fewer constraints to their conscious and unconscious biases, and therefore report more positive outcomes. Results confirmed the predictions at all levels considered: discipline, domain and methodology broadly defined. Controlling for observed differences between pure and applied disciplines, and between papers testing one or several hypotheses, the odds of reporting a positive result were around 5 times higher among papers in the disciplines of Psychology and Psychiatry and Economics and Business compared to Space Science, 2.3 times higher in the domain of social sciences compared to the physical sciences, and 3.4 times higher in studies applying behavioural and social methodologies on people compared to physical and chemical studies on non-biological material. In all comparisons, biological studies had intermediate values. These results suggest that the nature of hypotheses tested and the logical and methodological rigour employed to test them vary systematically across disciplines and fields, depending on the complexity of the subject matter and possibly other factors (e.g., a field's level of historical and/or intellectual development). On the other hand, these results support the scientific status of the social sciences against claims that they are completely subjective, by showing that, when they adopt a scientific approach to discovery, they differ from the natural sciences only by a matter of degree.",English,I don't see any of these,Student,"Applied Science, Social Science","Reproducibility and Replicability Knowledge,Replication Research","Reproducibility Crisis and Credibility Revolution,Open Science"
2020-06-05T19:18:22.188Z,Effect of open peer review on quality of reviews and on reviewers'recommendations: a randomised trial,https://doi.org/10.1136/bmj.318.7175.23,Susan van Rooyen et al.,"Primary Source, Reading, Paper",College / Upper Division (Undergraduates),"Objectives: To examine the effect on peer review of asking reviewers to have their identity revealed to the authors of the paper. Design: Randomised trial. Consecutive eligible papers were sent to two reviewers who were randomised to have their identity revealed to the authors or to remain anonymous. Editors and authors were blind to the intervention. Main outcome measures: The quality of the reviews was independently rated by two editors and the corresponding author using a validated instrument. Additional outcomes were the time taken to complete the review and the recommendation regarding publication. A questionnaire survey was undertaken of the authors of a cohort of manuscripts submitted for publication to find out their views on open peer review. Results: Two editors' assessments were obtained for 113out of 125 manuscripts, and the corresponding author's assessment was obtained for 105.Reviewers randomised to be asked to be identified were 12% (95% confidence interval 0.2% to 24%) more likely to decline to review than reviewers randomised to remain anonymous (35% v 23%). There was no significant difference in quality (scored on a scale of 1to 5) between anonymous reviewers (3.06(SD 0.72)) and identified reviewers (3.09(0.68)) (P=0.68, 95% confidence interval for difference −align=baseline>0.19 to 0.12), and no significant difference in the recommendation regarding publication or time taken to review the paper. The editors' quality score for reviews (3.05(SD 0.70)) was significantly higher than that of authors (2.90(0.87))(P<0.005, 95%confidence interval for difference − align=baseline>0.26 to − align=baseline>0.03). Most authors were in favour of open peer review.Conclusions: Asking reviewers to consent to being identified to the author had no important effect on the quality of the review, the recommendation regarding publication, or the time taken to review, but it significantly increased the likelihood of reviewers declining to review.",English,I don't see any of these,Student,"Applied Science, Social Science",,"Transparency,Open Science"
2020-06-05T19:19:33.825Z,"Theoretical risks and tabular asterisks: Sir Karl, Sir Ronald, and the slow progress of soft psychology.",https://doi.org/10.1037/0022-006X.46.4.806,"Meehl, P. E","Primary Source, Reading, Paper",College / Upper Division (Undergraduates),"Theories in ""soft"" areas of psychology (e.g., clinical, counseling, social, personality, school, and community) lack the cumulative character of scientific knowledge because they tend neither to be refuted nor corroborated, but instead merely fade away as people lose interest. Even though intrinsic subject matter difficulties (20 are listed) contribute to this, the excessive reliance on significance testing is partly responsible (Ronald A. Fisher). Karl Popper's approach, with modifications, would be prophylactic. Since the null hypothesis is quasi-always false, tables summarizing research in terms of patterns of ""significant differences"" are little more than complex, causally uninterpretable outcomes of statistical power functions. Multiple paths to estimating numerical point values (""consistency tests"") are better, even if approximate with rough tolerances; and lacking this, ranges, orderings, 2nd-order differences, curve peaks and valleys, and function forms should be used. Such methods are usual in developed sciences that seldom report statistical significance. Consistency tests of a conjectural taxometric model yielded 94% success with no false negatives. ",English,I don't see any of these,Student,"Applied Science, Social Science","Reproducibility and Replicability Knowledge,Replication Research","Reproducibility Crisis and Credibility Revolution,Open Science"
2020-06-05T19:20:42.716Z,Why Most Discovered True Associations Are Inflated,https://doi.org/10.1097/EDE.0b013e31818131e7,John P A Ioannidis,"Primary Source, Reading, Paper",College / Upper Division (Undergraduates),"Newly discovered true (non-null) associations often have inflated effects compared with the true effect sizes. I discuss here the main reasons for this inflation. First, theoretical considerations prove that when true discovery is claimed based on crossing a threshold of statistical significance and the discovery study is underpowered, the observed effects are expected to be inflated. This has been demonstrated in various fields ranging from early stopped clinical trials to genome-wide associations. Second, flexible analyses coupled with selective reporting may inflate the published discovered effects. The vibration ratio (the ratio of the largest vs. smallest effect on the same association approached with different analytic choices) can be very large. Third, effects may be inflated at the stage of interpretation due to diverse conflicts of interest. Discovered effects are not always inflated, and under some circumstances may be deflated-for example, in the setting of late discovery of associations in sequentially accumulated overpowered evidence, in some types of misclassification from measurement error, and in conflicts causing reverse biases. Finally, I discuss potential approaches to this problem. These include being cautious about newly discovered effect sizes, considering some rational down-adjustment, using analytical methods that correct for the anticipated inflation, ignoring the magnitude of the effect (if not necessary), conducting large studies in the discovery phase, using strict protocols for analyses, pursuing complete and transparent reporting of all results, placing emphasis on replication, and being fair with interpretation of results",English,I don't see any of these,Student,"Applied Science, Social Science","Reproducibility and Replicability Knowledge,Replication Research","Reproducibility Crisis and Credibility Revolution,Open Science"
2020-06-05T19:23:03.318Z,Statistical Procedures and the Justification of Knowledge in Psychological Science ,https://doi.org/10.1037/0003-066X.44.10.1276,"Rosnow, R.L., & Rosenthal, R. ","Primary Source, Reading, Paper",College / Upper Division (Undergraduates),"Justification, in the vernacular language of philosophy of science, refers to the evaluation, defense, and confirmation of claims of truth. In this article, we examine some aspects of the rhetoric of justification, which in part draws on statistical data analysis to shore up facts and inductive inferences. There are a number of problems of methodological spirit and substance that in the past have been resistant to attempts to correct them. The major problems are discussed, and readers are reminded of ways to clear away these obstacles to justification.",English,I don't see any of these,Student,"Applied Science, Social Science","Reproducibility and Replicability Knowledge,Replication Research","Reproducibility Crisis and Credibility Revolution,Open Science"
2020-06-05T19:25:50.192Z,"Replication, Communication, and the Population Dynamics of Scientific Discovery",https://doi.org/10.1371/journal.pone.0136088,"Richard McElreath, Paul E. Smaldino","Primary Source, Reading, Paper",College / Upper Division (Undergraduates),"Many published research results are false (Ioannidis, 2005), and controversy continues over the roles of replication and publication policy in improving the reliability of research. Addressing these problems is frustrated by the lack of a formal framework that jointly represents hypothesis formation, replication, publication bias, and variation in research quality. We develop a mathematical model of scientific discovery that combines all of these elements. This model provides both a dynamic model of research as well as a formal framework for reasoning about the normative structure of science. We show that replication may serve as a ratchet that gradually separates true hypotheses from false, but the same factors that make initial findings unreliable also make replications unreliable. The most important factors in improving the reliability of research are the rate of false positives and the base rate of true hypotheses, and we offer suggestions for addressing each. Our results also bring clarity to verbal debates about the communication of research. Surprisingly, publication bias is not always an obstacle, but instead may have positive impacts—suppression of negative novel findings is often beneficial. We also find that communication of negative replications may aid true discovery even when attempts to replicate have diminished power. The model speaks constructively to ongoing debates about the design and conduct of science, focusing analysis and discussion on precise, internally consistent models, as well as highlighting the importance of population dynamics",English,I don't see any of these,Student,"Applied Science, Social Science","Reproducibility and Replicability Knowledge,Replication Research","Reproducibility Crisis and Credibility Revolution,Open Science"
2020-06-05T19:27:33.056Z,"Badges to Acknowledge Open Practices: A Simple, Low-Cost, Effective Method for Increasing Transparency",https://doi.org/10.1371/journal.pbio.1002456,Mallory C. Kidwell et al.,"Primary Source, Reading, Paper",College / Upper Division (Undergraduates),"Beginning January 2014, Psychological Science gave authors the opportunity to signal open data and materials if they qualified for badges that accompanied published articles. Before badges, less than 3% of Psychological Science articles reported open data. After badges, 23% reported open data, with an accelerating trend; 39% reported open data in the first half of 2015, an increase of more than an order of magnitude from baseline. There was no change over time in the low rates of data sharing among comparison journals. Moreover, reporting openness does not guarantee openness. When badges were earned, reportedly available data were more likely to be actually available, correct, usable, and complete than when badges were not earned. Open materials also increased to a weaker degree, and there was more variability among comparison journals. Badges are simple, effective signals to promote open practices and improve preservation of data and materials by using independent repositories.",English,I don't see any of these,Student,"Applied Science, Social Science","Reproducibility and Replicability Knowledge,Reproducible Analyses,Open Data and Materials,Replication Research","Reproducibility Crisis and Credibility Revolution,Open Science"
2020-06-05T19:29:27.056Z,Likelihood of Null Effects of Large NHLBI Clinical Trials Has Increased over Time,https://doi.org/10.1371/journal.pone.0132382,"Kaplan RM, Irvin VL ","Primary Source, Reading, Paper",College / Upper Division (Undergraduates),"Background: We explore whether the number of null results in large National Heart Lung, and Blood Institute (NHLBI) funded trials has increased over time. Methods: We identified all large NHLBI supported RCTs between 1970 and 2012 evaluating drugs or dietary supplements for the treatment or prevention of cardiovascular disease. Trials were included if direct costs >$500,000/year, participants were adult humans, and the primary outcome was cardiovascular risk, disease or death. The 55 trials meeting these criteria were coded for whether they were published prior to or after the year 2000, whether they registered in clinicaltrials.gov prior to publication, used active or placebo comparator, and whether or not the trial had industry co-sponsorship. We tabulated whether the study reported a positive, negative, or null result on the primary outcome variable and for total mortality. Results: 17 of 30 studies (57%) published prior to 2000 showed a significant benefit of intervention on the primary outcome in comparison to only 2 among the 25 (8%) trials published after 2000 (χ2=12.2,df= 1, p=0.0005). There has been no change in the proportion of trials that compared treatment to placebo versus active comparator. Industry co-sponsorship was unrelated to the probability of reporting a significant benefit. Pre-registration in clinical trials.gov was strongly associated with the trend toward null findings. Conclusions: The number NHLBI trials reporting positive results declined after the year 2000. Prospective declaration of outcomes in RCTs, and the adoption of transparent reporting standards, as required by clinicaltrials.gov, may have contributed to the trend toward null findings.",English,I don't see any of these,Student,Life Science,"Reproducibility and Replicability Knowledge,Preregistration,Replication Research","Reproducibility Crisis and Credibility Revolution,Open Science,Transparency"
2020-06-05T19:31:32.930Z,Rewarding Replications: A Sure and Simple Way to Improve Psychological Science,https://doi.org/10.1177/1745691612462586,"Sander L Koole, Daniël Lakens","Primary Source, Reading, Paper",College / Upper Division (Undergraduates),"Although replications are vital to scientific progress, psychologists rarely engage in systematic replication efforts. In this article, we consider psychologists’ narrative approach to scientific publications as an underlying reason for this neglect and propose an incentive structure for replications within psychology. First, researchers need accessible outlets for publishing replications. To accomplish this, psychology journals could publish replication reports in files that are electronically linked to reports of the original research. Second, replications should get cited. This can be achieved by cociting replications along with original research reports. Third, replications should become a valued collaborative effort. This can be realized by incorporating replications in teaching programs and by stimulating adversarial collaborations. The proposed incentive structure for replications can be developed in a relatively simple and cost-effective manner. By promoting replications, this incentive structure may greatly enhance the dependability of psychology’s knowledge base.",English,I don't see any of these,Student,"Applied Science, Social Science","Reproducibility and Replicability Knowledge,Replication Research","Reproducibility Crisis and Credibility Revolution,Open Science"
2020-06-05T19:33:05.179Z,Statistical methods in psychology journals: Guidelines and explanations.,https://doi.org/10.1037/0003-066X.54.8.594,"Wilkinson, L., & Task Force on Statistical Inference, American Psychological Association, Science Directorate.","Primary Source, Reading, Paper",College / Upper Division (Undergraduates),"In the light of continuing debate over the applications of significance testing in psychology journals and following the publication of J. Cohen's (1994) article, the Board of Scientific Affairs (BSA) of the American Psychological Association (APA) convened a committee called the Task Force on Statistical Interference (TFSI) whose charge was ""to elucidate some of the controversial issues surrounding applications of statistics including significance testing and its alternatives; alternative underlying models and data transformation; and newer methods made possible by powerful computers"" (BSA, personal communication, February 28, 1996). After extensive discussion, the BSA recommended that publishing an article in American Psychologist, as a way to initiate discussion in the field about changes in current practices of data analysis and reporting may be appropriate. This report follows that request. Following each guideline are comments, explanations, or elaborations assembled by L. Wilkinson for the task force and under its review. The report is concerned with the use of statistical methods only and is not meant as an assessment of research methods in general. The title and format of the report are adapted from an article by J. C. Bailar and F. Mosteller (1988).",English,I don't see any of these,Student,Math & Statistics,Conceptual and Statistical Knowledge,
2020-06-05T19:34:31.478Z,Is the call to abandon p-values the red herring of the replicability crisis? ,https://doi.org/10.3389/fpsyg.2015.00245,Victoria Savalei and Elizabeth Dunn,"Primary Source, Reading, Paper",College / Upper Division (Undergraduates),A paper about Is the call to abandon p-values the red herring of the replicability crisis?,English,I don't see any of these,Student,Math & Statistics,Conceptual and Statistical Knowledge,
