2020-05-16T06:36:40.345Z,Faking Science: A True Story of Academic Fraud,https://errorstatistics.files.wordpress.com/2014/12/fakingscience-20141214.pdf,Diederik Stapel/Translated by Nicholas J. L. Brown,Primary Source,College / Upper Division (Undergraduates),A book about Academic Fraud,English,CC BY-NC-ND,"Student, Teacher","Applied Science, Social Science","Reproducibility and Replicability Knowledge,Reproducible Analyses,Replication Research","Textbook,Reproducibility Crisis and Credibility Revolution"
2020-05-16T07:21:04.327Z,Science and Pseudoscience BBC Radio Talk,http://www.lse.ac.uk/philosophy/department-history/science-and-pseudoscience-overview-and-transcript/,London School of Economics and Political Science,"Student Guide, Teaching/Learning Strategy, Podcast",College / Upper Division (Undergraduates),A podcast about science and pseudoscience,English,I don't see any of these,"Student, Teacher","Applied Science, Social Science","Reproducibility and Replicability Knowledge,Replication Research","Podcast,Reproducibility Crisis and Credibility Revolution"
2020-05-16T07:32:40.694Z,Stereotype threat,https://www.wnycstudios.org/story/stereothreat/,"Simon Adler, Amanda Aronczyk and Dan Engber","Teaching/Learning Strategy, Podcast",College / Upper Division (Undergraduates),A podcast about stereotype threat and replication,English,I don't see any of these,"Student, Teacher","Applied Science, Social Science","Reproducible Analyses,Preregistration,Open Data and Materials,Replication Research","Podcast,Reproducibility Knowledge,Reproducibility Crisis and Credibility Revolution"
2020-05-16T10:33:44.148Z,The Hidden Brain,https://www.npr.org/2016/05/24/477921050/when-great-minds-think-unlike-inside-sciences-replication-crisis,Shankar Vedantam and Maggie Penman,"Student Guide, Teaching/Learning Strategy, Podcast",College / Upper Division (Undergraduates),A podcast about replication crisis,English,I don't see any of these,"Student, Teacher","Applied Science, Social Science",Replication Research,"Podcast,Reproducibility Knowledge,Reproducibility Crisis and Credibility Revolution"
2020-05-16T10:35:36.465Z,Neuroscientist Explains,https://www.theguardian.com/science/audio/2018/mar/19/a-neuroscientist-explains-psychologys-replication-crisis-podcast,Daniel Glaser,"Student Guide, Teaching/Learning Strategy, Podcast",College / Upper Division (Undergraduates),Daniel Glaser apprehensively revisits an article of his that saw some fallout due to a study he cited. But that study was not the only one involved in what is now being called a crisis for psychology and further afield,English,I don't see any of these,Student,"Applied Science, Social Science",Replication Research,"Podcast,Reproducibility Knowledge,Reproducibility Crisis and Credibility Revolution"
2020-05-16T10:37:17.656Z,Detecting fraud in social science,http://rationallyspeakingpodcast.org/show/rs-155-uri-simonsohn-on-detecting-fraud-in-social-science.html,Julia Galef/Uri Simonsohn,"Teaching/Learning Strategy, Unit of Study, Podcast",College / Upper Division (Undergraduates),"He's been called a ""Data vigilante."" In this episode, Prof. Uri Simonsohn describes how he detects fraudulent work in psychology and economics -- what clues tip him off? How big of a problem is fraud relative to other issues like P-hacking? And what solutions are there?",English,I don't see any of these,"Student, Teacher","Applied Science, Social Science",Replication Research,"Podcast,Reproducibility Knowledge,Reproducibility Crisis and Credibility Revolution"
2020-05-16T10:43:38.483Z,The Experiment Experiment,http://www.npr.org/sections/money/2016/01/15/463237871/episode-677-the-experiment-experiment,Planet Money,"Student Guide, Teaching/Learning Strategy, Podcast",College / Upper Division (Undergraduates),"A few years back, a famous psychologist published a series of studies that found people could predict the future — not all the time, but more often than if they were guessing by chance alone.The paper left psychologists with two options. ""Either we have to conclude that ESP is true,"" says Brian Nosek, a psychologist at the University of Virginia, ""or we have to change our beliefs about the right ways to do science."" Nosek is going with Option B — and not just for psychology experiments. He thinks there's something wrong with the way we're doing science. And he launched a massive project to try to fix it.",English,I don't see any of these,Student,"Applied Science, Social Science",Replication Research,"Podcast,Reproducibility Knowledge,Reproducibility Crisis and Credibility Revolution"
2020-05-16T11:07:57.302Z,Everything Hertz,https://soundcloud.com/everything-hertz,Sound Cloud,"Student Guide, Teaching/Learning Strategy, Podcast",College / Upper Division (Undergraduates),A podcast about open science and psychology,English,I don't see any of these,"Student, Teacher","Applied Science, Social Science","Reproducibility and Replicability Knowledge,Reproducible Analyses,Preregistration,Open Data and Materials,Replication Research","Podcast,Reproducibility Crisis and Credibility Revolution"
2020-05-16T11:19:55.592Z,You are not so smart,https://youarenotsosmart.com/2017/07/19/yanss-100-the-replication-crisis/,David McRaney,"Student Guide, Teaching/Learning Strategy, Podcast",College / Upper Division (Undergraduates),"Psychology is working on the hardest problems in all of science. Physics, astronomy, geology — those are easy, by comparison. Understanding consciousness, willpower, ideology, social change – there’s a larger-than-Large-Hadron-Collider level of difficulty to each one of these, but since these are more relatable ideas than quarks and bosons and mass coronal ejections — this a science about our minds and selves — it’s easier to create eye-catching headlines and, well, to make podcasts about them. This is the problem. Because the system for distributing the findings of science is based on publication within journals, which themselves are often depend on the interest of the general media, all the biases that come with that system and media consumption in general are now causing the sciences that are most interesting to the public to get tainted by that interest. As you will hear in this episode, one of the most famous and most talked-about phenomena in recent psychological history, ego depletion, hasn’t been doing so well in replication attempts. In the show, journalist Daniel Engber who wrote an article for Slate about the failure to replicate many of the famous ego depletion experiments will detail what this means for the science and the scientists involved. Also, you’ll hear from psychologist Brain Nosek, who says, “Science is wrong about everything, but you can trust it more than anything.” Nosek is director of the Center for Open Science, an organization working to correct what they see as the temporarily wayward path of psychology. Nosek recently lead a project in which 270 scientists sought to replicate 100 different studies in psychology, all published in 2008 — 97 of which claimed to have found significant results — and in the end, two-thirds failed to replicate. Clearly, some sort of course correction is in order. There is now a massive effort underway sort out what is being called the replication crisis. Much of the most headline-producing research in the last 20 years isn’t standing up to attempts to reproduce its findings. Nosek wants to clean up the processes that have lead to this situation, and in this episode, you’ll learn how he and others plan to do so.",English,I don't see any of these,"Student, Teacher","Applied Science, Social Science","Reproducibility and Replicability Knowledge,Reproducible Analyses,Preregistration,Open Data and Materials,Replication Research","Podcast,Reproducibility Crisis and Credibility Revolution"
2020-05-16T11:34:46.639Z,Open science: many hands make light work,https://www.jisc.ac.uk/podcasts/open-science-many-hands-make-light-work-30-oct-2015,Jisc,"Student Guide, Teaching/Learning Strategy, Podcast",College / Upper Division (Undergraduates),Open science has been highlighted as one of the priorities of the Dutch presidency of the European Union in 2016. Matthew Dovey discusses the motivations behind the open science movement and why initiatives to support it are more important than ever. Read his original blog.,English,I don't see any of these,"Student, Teacher","Applied Science, Social Science","Reproducibility and Replicability Knowledge,Reproducible Analyses,Preregistration,Open Data and Materials,Replication Research","Podcast,Reproducibility Crisis and Credibility Revolution"
2020-05-16T12:04:50.998Z,Circle of Willis (episode with Sinime Vazire),http://circleofwillispodcast.com/episode-8-simine-vazire,Jim Coan,"Student Guide, Teaching/Learning Strategy, Podcast",College / Upper Division (Undergraduates),"Welcome to Episode 8, where I talk to SIMINE VAZIRE, Associate Professor of Psychology at the University of California at Davis, about the stability of personality, our ability to know ourselves, and some of the nuances within the prescriptive advice of the Open Science Movement.  Simine wears a number of different hats. In recent years, she’s been at or near the center of ongoing conversations among scientists about the virtues and challenges of open science. As part of this work, she co-founded the Society for the Improvement of Psychological Science (SIPS) and co-hosts a science podcast (with Sanjay Srivastava and Alexa Tullett) called THE BLACK GOAT. Simine is also editor in chief of the journal Social Psychological and Personality Science and a senior editor at Collabra. Interestingly, Simine has also been a part of the conversation about the process of criticism in science. As most listeners well know, criticism is unquestionably essential if science is going to be self-correcting (which is of course the whole point!). One question the field has been grappling with is the point at which criticism crosses over into harassment and bullying—a question at the heart of a recent op-ed Simine wrote for Slate. I have my own thoughts on this question, which I’ll save for another time, but one of the reasons I was so keen to ask Simine to be on Circle of Willis is that I find her approach to grappling with such questions to be equal parts humble, charitable, and firm. She isn’t likely to allow a legitimate criticism to be brushed aside in order to avoid hurting someone's feelings, but neither is she going to participate in (or for that matter tolerate) bullying. I think that in our age of shoot-from-the-hip outrage, that can be a hard path to find, let alone walk, and I genuinely admire her efforts. There are many other things I love about Simine, but as you’ll hear in this episode, at or near the top of the list of her agreeable traits is that she’ll be the first to tell any of you that sometimes she’s wrong. We try to be right while tolerating (and admitting to) our mistakes.  Oh, and — seriously — keep a notepad handy for this episode. Simine is unusually quotable!",English,I don't see any of these,"Student, Teacher","Applied Science, Social Science","Reproducibility and Replicability Knowledge,Reproducible Analyses,Preregistration,Open Data and Materials,Replication Research","Podcast,Reproducibility Crisis and Credibility Revolution"
2020-05-16T12:08:21.186Z,P-Hacking and Other Problems in Psychology Research,http://rationallyspeakingpodcast.org/show/rs123-daniel-lakens-on-p-hacking-and-other-problems-in-psych.html,"Julia Galef, Massimo Pigliucci and Benny Pollak","Student Guide, Teaching/Learning Strategy, Podcast",College / Upper Division (Undergraduates),"What's wrong with the social sciences? In this episode, Massimo and Julia are joined by Professor Daniel Lakens from the Eindhoven University of Technology, who studies psychology and blogs about research methods and open science. The three discuss why so many psychology papers can't be trusted, and what solutions might exist for the problem (including how to fix the skewed incentives in the field).",English,I don't see any of these,"Student, Teacher","Applied Science, Social Science","Reproducibility and Replicability Knowledge,Reproducible Analyses,Preregistration,Open Data and Materials,Replication Research","Podcast,Reproducibility Crisis and Credibility Revolution"
2020-05-16T12:11:05.263Z,ReproducibiliTea,https://soundcloud.com/reproducibilitea,"Sophia Cruwell, Amy Orben and Sam Parsons","Student Guide, Unit of Study","College / Upper Division (Undergraduates), Graduate / Professional","Serving mugs of Reproducibili☕️: Blends include transparency, openness and robustness + a spoonful of science.",English,I don't see any of these,"Student, Teacher","Applied Science, Social Science","Reproducibility and Replicability Knowledge,Conceptual and Statistical Knowledge,Reproducible Analyses,Preregistration,Open Data and Materials,Replication Research","Podcast,Reproducibility Crisis and Credibility Revolution,Open Science"
2020-05-16T12:47:35.074Z,The Black Goat,http://www.theblackgoatpodcast.com/,"Sanjay Srivastava, Alexa Tullett, and Simine Vazire","Student Guide, Unit of Study, Podcast",College / Upper Division (Undergraduates),"Three psychologists talk about doing science. Hosted by Sanjay Srivastava, Alexa Tullett, and Simine Vazire.",English,I don't see any of these,"Student, Teacher","Applied Science, Social Science","Reproducibility and Replicability Knowledge,Reproducible Analyses,Preregistration,Open Data and Materials,Replication Research","Podcast,Reproducibility Crisis and Credibility Revolution"
2020-05-16T12:49:35.192Z,The Bayes Factor,https://sites.tufts.edu/hilab/podcast/,Prof. JP De Ruiter,"Student Guide, Teaching/Learning Strategy, Podcast",College / Upper Division (Undergraduates),"In this episode JP and Alex interview Zoltan Dienes. They discuss Zoltan's passion for the martial arts, why Bayesian inference could be more Popperian than you might think,  and the easiest way to start using Bayesian statistics in practice.",English,I don't see any of these,"Student, Teacher","Applied Science, Math & Statistics, Social Science",Conceptual and Statistical Knowledge,Podcast
2020-05-19T16:34:08.333Z,Understanding psychology as a science: An introduction to scientific and statistical inference,https://he.palgrave.com/page/detail/?sf1=barcode&st1=9780230542303,Zoltan Dienes,Textbook,Graduate / Professional,"How can we objectively define categories of truth in scientific thinking? How can we reliably measure the results of research? In this ground-breaking text, Dienes undertakes a comprehensive historical analysis of the dominant schools of thought, key theories and influential thinkers that have progressed the foundational principles and characteristics that typify scientific research methodology today. This book delivers a masterfully simple, ‘though not simplistic’, introduction to the core arguments surrounding Popper, Kuhn and Lakatos, Fisher and Royall, Neyman and Pearson and Bayes. Subsequently, this book clarifies the prevalent misconceptions that surround such theoretical perspectives in psychology today, providing an especially accessible critique for student readers.  ",English,I don't see any of these,"Student, Teacher, Researcher","Applied Science, Life Science, Math & Statistics, Social Science",Conceptual and Statistical Knowledge,Book
2020-05-19T16:38:10.820Z,Statistical Evidence: A Likelihood Paradigm,https://www.routledge.com/Statistical-Evidence-A-Likelihood-Paradigm/Royall/p/book/9780412044113?utm_source=crcpress.com&utm_medium=referral,Richard Royall,Textbook,"College / Upper Division (Undergraduates), Graduate / Professional, Career /Technical","Interpreting statistical data as evidence, Statistical Evidence: A Likelihood Paradigm focuses on the law of likelihood, fundamental to solving many of the problems associated with interpreting data in this way. Statistics has long neglected this principle, resulting in a seriously defective methodology. This book redresses the balance, explaining why science has clung to a defective methodology despite its well-known defects. After examining the strengths and weaknesses of the work of Neyman and Pearson and the Fisher paradigm, the author proposes an alternative paradigm which provides, in the law of likelihood, the explicit concept of evidence missing from the other paradigms. At the same time, this new paradigm retains the elements of objective measurement and control of the frequency of misleading results, features which made the old paradigms so important to science. The likelihood paradigm leads to statistical methods that have a compelling rationale and an elegant simplicity, no longer forcing the reader to choose between frequentist and Bayesian statistics. ",English,I don't see any of these,"Student, Teacher, Researcher",Math & Statistics,Conceptual and Statistical Knowledge,Book
2020-05-19T16:41:14.955Z,Dyadic Data Analysis (Methodology in the Social Sciences),https://www.amazon.com/Dyadic-Analysis-Methodology-Social-Sciences/dp/1572309865?ie=UTF8&psc=1&redirect=true&ref_=oh_aui_detailpage_o09_s00,"David A. Kenny, Deborah A. Kashy, William L. Cook",Textbook,"College / Upper Division (Undergraduates), Graduate / Professional","Interpersonal phenomena such as attachment, conflict, person perception, helping, and influence have traditionally been studied by examining individuals in isolation, which falls short of capturing their truly interpersonal nature. This book offers state-of-the-art solutions to this age-old problem by presenting methodological and data-analytic approaches useful in investigating processes that take place among dyads: couples, coworkers, or parent-child, teacher-student, or doctor-patient pairs, to name just a few. Rich examples from psychology and across the behavioral and social sciences help build the researcher's ability to conceptualize relationship processes; model and test for actor effects, partner effects, and relationship effects; and model the statistical interdependence that can exist between partners. The companion website provides clarifications, elaborations, corrections, and data and files for each chapter.",English,I don't see any of these,"Student, Teacher, Researcher","Applied Science, Math & Statistics, Social Science",Conceptual and Statistical Knowledge,Book
2020-05-19T16:43:29.962Z,Exploratory Factor Analysis,https://www.amazon.com/Exploratory-Factor-Analysis-Understanding-Statistics/dp/0199734178?ie=UTF8&psc=1&redirect=true&ref_=oh_aui_detailpage_o00_s00,"Leandre R. Fabrigar, Dueane T. Wegener",Textbook,"College / Upper Division (Undergraduates), Graduate / Professional, Career /Technical","This book provides a non-mathematical introduction to the underlying theory of Efa and reviews the key decisions that must be made in its implementation. Among the issues discussed are the use of confirmatory versus exploratory factor analysis, the use of principal components analysis versus common factor analysis, procedures for determining the appropriate number of factors, and methods for rotating factor solutions. Explanations and illustrations of the application of different factor analytic procedures are provided for analyses using common statistical packages (Spss and Sas), as well as a free package available on the web (Comprehensive Exploratory Factor Analysis). In addition, practical instructions are provided for conducting a number of useful factor analytic procedures not included in the statistical packages.",English,I don't see any of these,"Student, Teacher, Researcher","Applied Science, Life Science, Math & Statistics, Social Science",Conceptual and Statistical Knowledge,Book
2020-05-19T16:46:40.198Z,"Introduction to Mediation, Moderation, and Conditional Process Analysis, First Edition: A Regression-Based Approach (Methodology in the Social Sciences)",https://www.amazon.com/Introduction-Mediation-Moderation-Conditional-Analysis/dp/1609182308?ie=UTF8&psc=1&redirect=true&ref_=oh_aui_detailpage_o03_s00,Andrew F. Hayes,Textbook,"College / Upper Division (Undergraduates), Graduate / Professional, Career /Technical","Explaining the fundamentals of mediation and moderation analysis, this engaging book also shows how to integrate the two using an innovative strategy known as conditional process analysis. Procedures are described for testing hypotheses about the mechanisms by which causal effects operate, the conditions under which they occur, and the moderation of mechanisms. Relying on the principles of ordinary least squares regression, Andrew Hayes carefully explains the estimation and interpretation of direct and indirect effects, probing and visualization of interactions, and testing of questions about moderated mediation. Examples using data from published studies illustrate how to conduct and report the analyses described in the book. Of special value, the book introduces and documents PROCESS, a macro for SPSS and SAS that does all the computations described in the book. The companion website (www.afhayes.com) offers free downloads of PROCESS plus data files for the book's examples.",English,I don't see any of these,"Student, Teacher, Researcher","Applied Science, Social Science",Conceptual and Statistical Knowledge,Book
2020-05-19T16:48:12.793Z,Introduction to Meta-Analysis,https://www.amazon.com/Introduction-Meta-Analysis-Michael-Borenstein/dp/0470057246?ie=UTF8&psc=1&redirect=true&ref_=oh_aui_detailpage_o02_s00,"Michael Borenstein, Larry V. Hedges, Julian P.T. Higgins, Hannah R. Rothstein",Textbook,"College / Upper Division (Undergraduates), Graduate / Professional, Career /Technical","This book provides a clear and thorough introduction to meta-analysis, the process of synthesizing data from a series of separate studies. Meta-analysis has become a critically important tool in fields as diverse as medicine, pharmacology, epidemiology, education, psychology, business, and ecology.",English,I don't see any of these,"Student, Teacher, Researcher","Applied Science, Life Science, Math & Statistics, Physical Science, Social Science",Conceptual and Statistical Knowledge,Book
2020-05-19T16:49:10.473Z,Longitudinal Structural Equation Modeling (Methodology in the Social Sciences),https://www.amazon.com/Longitudinal-Structural-Equation-Modeling-Methodology/dp/1462510167?ie=UTF8&psc=1&redirect=true&ref_=oh_aui_detailpage_o03_s00,Todd D. Little,Textbook,"College / Upper Division (Undergraduates), Graduate / Professional, Career /Technical","Featuring actual datasets as illustrative examples, this book reveals numerous ways to apply structural equation modeling (SEM) to any repeated-measures study. Initial chapters lay the groundwork for modeling a longitudinal change process, from measurement, design, and specification issues to model evaluation and interpretation. Covering both big-picture ideas and technical ""how-to-do-it"" details, the author deftly walks through when and how to use longitudinal confirmatory factor analysis, longitudinal panel models (including the multiple-group case), multilevel models, growth curve models, and complex factor models, as well as models for mediation and moderation. User-friendly features include equation boxes that clearly explain the elements in every equation, end-of-chapter glossaries, and annotated suggestions for further reading. The companion website (www.guilford.com/little-materials) provides datasets for all of the examples--which include studies of bullying, adolescent students' emotions, and healthy aging--with syntax and output from LISREL, Mplus, and R (lavaan).",English,I don't see any of these,"Student, Teacher, Researcher","Applied Science, Math & Statistics, Social Science",Conceptual and Statistical Knowledge,Book
2020-05-19T16:50:30.775Z,Multilevel Analysis: An Introduction to Basic and Advanced Multilevel Modeling,https://www.amazon.com/Multilevel-Analysis-Introduction-Advanced-Modeling/dp/0761958908?ie=UTF8&psc=1&redirect=true&ref_=oh_aui_detailpage_o07_s00,"Tom A.B. Snijders, Roel Bosker",Textbook,"College / Upper Division (Undergraduates), Graduate / Professional, Career /Technical","The main methods, techniques and issues for carrying out multilevel modeling and analysis are covered in this book. The book is an applied introduction to the topic, providing a clear conceptual understanding of the issues involved in multilevel analysis and will be a useful reference tool. Information on designing multilevel studies, sampling, testing and model specification and interpretation of models is provided. A comprehensive guide to the software available is included. Multilevel Analysis is the ideal guide for researchers and applied statisticians in the social sciences, including education, but will also interest researchers in economics, and biological, medical and health disciplines.",English,I don't see any of these,"Student, Teacher, Researcher","Applied Science, Math & Statistics, Social Science",Conceptual and Statistical Knowledge,Book
2020-05-19T16:51:55.275Z,Applied Multiple Regression/Correlation Analysis for the Behavioral Sciences,https://www.amazon.com/Multiple-Regression-Correlation-Analysis-Behavioral/dp/0805822232?ie=UTF8&psc=1&redirect=true&ref_=oh_aui_detailpage_o03_s00,"Jacob Cohen, Patricia Cohen, Stephen G. West, Leona S. Aiken",Textbook,"College / Upper Division (Undergraduates), Graduate / Professional","This classic text on multiple regression is noted for its nonmathematical, applied, and data-analytic approach. Readers profit from its verbal-conceptual exposition and frequent use of examples.",English,I don't see any of these,"Student, Teacher, Researcher","Applied Science, Math & Statistics, Social Science",Conceptual and Statistical Knowledge,Book
