2020-05-27T17:05:25.015Z,Academic Research in the 21st Century: Maintaining Scientific Integrity in a Climate of Perverse Incentives and Hypercompetition,https://doi.org/10.1089/ees.2016.0223,Marc A. Edwards and Siddhartha Roy,"Primary Source, Reading, Paper",College / Upper Division (Undergraduates),"Over the last 50 years, we argue that incentives for academic scientists have become increasingly perverse in terms of competition for research funding, development of quantitative metrics to measure performance, and a changing business model for higher education itself. Furthermore, decreased discretionary funding at the federal and state level is creating a hypercompetitive environment between government agencies (e.g., EPA, NIH, CDC), for scientists in these agencies, and for academics seeking funding from all sources—the combination of perverse incentives and decreased funding increases pressures that can lead to unethical behavior. If a critical mass of scientists become untrustworthy, a tipping point is possible in which the scientific enterprise itself becomes inherently corrupt and public trust is lost, risking a new dark age with devastating consequences to humanity. Academia and federal agencies should better support science as a public good, and incentivize altruistic and ethical outcomes, while de-emphasizing output.",English,I don't see any of these,Student,"Applied Science, Social Science","Reproducibility and Replicability Knowledge,Replication Research","Reproducibility Crisis and Credibility Revolution,Open Science"
2020-05-27T17:12:08.421Z,"Open sharing of data on close relationships and other sensitive social psychological topics: Challenges, tools, and future directions",https://doi.org/10.1177/2515245917744281,"Joel, S., Eastwick, P., & Finkel, E. ","Primary Source, Reading, Paper",College / Upper Division (Undergraduates),"This article reports on an adversarial (but friendly) collaboration examining the issues that lie at the intersection of confidentiality and open-data practices. We describe the process we followed to share our data for a speed-dating article we recently published in Psychological Science (Joel, Eastwick, & Finkel, 2017) and provide a summary of the issues we considered and addressed along the way. As we drafted the present article, the third author became unsure, in retrospect, about some of the procedures we had followed, especially if our approach were to be perceived as a model for open-data decisions in other, more typical cases involving nonindependent data. This article addresses these concerns, but also identifies areas of consensus. All three authors agree that there remains an unmet need for guidelines and other resources to help researchers address the challenges of sharing data that cover sensitive topics, particularly nonindependent data collected from pairs and groups (e.g., romantic couples, work teams, therapy groups). We conclude with a discussion of new tools that could be developed to help scholars who have collected such data to increase the transparency of their research while simultaneously protecting the confidentiality of the participants.",English,I don't see any of these,Student,"Applied Science, Social Science","Reproducibility and Replicability Knowledge,Replication Research","Reproducibility Crisis and Credibility Revolution,Open Science"
2020-05-27T17:14:57.354Z,Registered Reports: A New Publishing Initiative at Cortex,https://doi.org/10.1016/j.cortex.2012.12.016,Christopher Chambers,"Primary Source, Reading, Paper",College / Upper Division (Undergraduates),An article about registered Reports: A new publishing initiative at Cortex,English,I don't see any of these,Student,"Applied Science, Social Science","Reproducibility and Replicability Knowledge,Replication Research","Reproducibility Crisis and Credibility Revolution,Open Science"
2020-05-27T17:17:33.853Z,On the reproducibility of psychological science,https://doi.org/10.1080/01621459.2016.1240079,"Valen E. Johnson, Richard D. Payne,Tianying Wang,Alex Asher &Soutrik Mandal","Primary Source, Reading, Paper",College / Upper Division (Undergraduates),"Investigators from a large consortium of scientists recently performed a multi-year study in which they replicated 100 psychology experiments. Although statistically significant results were reported in 97% of the original studies, statistical significance was achieved in only 36% of the replicated studies. This article presents a reanalysis of these data based on a formal statistical model that accounts for publication bias by treating outcomes from unpublished studies as missing data, while simultaneously estimating the distribution of effect sizes for those studies that tested non-null effects. The resulting model suggests that more than 90% of tests performed in eligible psychology experiments tested negligible effects, and that publication biases based on p-values caused the observed rates of nonreproducibility. The results of this reanalysis provide a compelling argument for both increasing the threshold required for declaring scientific discoveries and for adopting statistical summaries of evidence that account for the high proportion of tested hypotheses that are false. Supplementary materials for this article are available online.",English,I don't see any of these,Student,"Applied Science, Social Science","Reproducibility and Replicability Knowledge,Replication Research","Reproducibility Crisis and Credibility Revolution,Open Science"
2020-05-27T17:18:52.283Z,Estimating the reproducibility of psychological science,https://doi.org/10.1126/science.aac4716,Open Science Collaboration. ,"Primary Source, Reading, Paper",College / Upper Division (Undergraduates),"Reproducibility is a defining feature of science, but the extent to which it characterizes current research is unknown. We conducted replications of 100 experimental and correlational studies published in three psychology journals using high-powered designs and original materials when available. Replication effects were half the magnitude of original effects, representing a substantial decline. Ninety-seven percent of original studies had statistically significant results. Thirty-six percent of replications had statistically significant results; 47% of original effect sizes were in the 95% confidence interval of the replication effect size; 39% of effects were subjectively rated to have replicated the original result; and if no bias in original results is assumed, combining original and replication results left 68% with statistically significant effects. Correlational tests suggest that replication success was better predicted by the strength of original evidence than by characteristics of the original and replication teams.",English,I don't see any of these,Student,"Applied Science, Social Science","Reproducibility and Replicability Knowledge,Replication Research","Reproducibility Crisis and Credibility Revolution,Open Science"
2020-05-28T13:01:48.975Z,The frequency of excess success for articles in Psychological Science.,https://doi.org/10.3758/s13423-014-0601-x,Gregory Francis,"Primary Source, Reading, Paper",College / Upper Division (Undergraduates),"Recent controversies have questioned the quality of scientific practice in the field of psychology, but these concerns are often based on anecdotes and seemingly isolated cases. To gain a broader perspective, this article applies an objective test for excess success to a large set of articles published in the journal Psychological Science between 2009 and 2012. When empirical studies succeed at a rate much higher than is appropriate for the estimated effects and sample sizes, readers should suspect that unsuccessful findings have been suppressed, the experiments or analyses were improper, or the theory does not properly account for the data. In total, problems appeared for 82 % (36 out of 44) of the articles in Psychological Science that had four or more experiments and could be analyzed.",English,I don't see any of these,Student,"Applied Science, Social Science","Reproducibility and Replicability Knowledge,Replication Research","Reproducibility Crisis and Credibility Revolution,Open Science"
2020-05-28T13:04:25.650Z,SCIENTIFIC APOPHENIA IN STRATEGIC MANAGEMENT RESEARCH: SIGNIFICANCE TESTS & MISTAKEN INFERENCE,https://doi.org/10.1002/smj.2459,BRENT GOLDFARB and ANDREW A. KING,"Primary Source, Reading, Paper",College / Upper Division (Undergraduates),"This article uses distributional matching and posterior predictive checks to estimate the extent of false and inflated findings in empirical research on strategic management. Based on a sample of 300 papers in top outlets for research on strategic management, we estimate that if each study were repeated, 24–40 percent of significant coefficients would become insignificant at the five percent level. Our best guess is that for about half of these, the true coefficient is very close to 0. The remaining coefficients are likely directionally correct but inflated in magnitude. We offer several practical individual and field level suggestions for reducing scientific apophenia, that is, our tendency to find and publish evidence of order where none exists.",English,I don't see any of these,Student,"Applied Science, Social Science","Reproducibility and Replicability Knowledge,Conceptual and Statistical Knowledge,Replication Research","Reproducibility Crisis and Credibility Revolution,Open Science"
2020-05-28T13:06:08.688Z,Many Labs 3: Evaluating participant pool quality across the academic semester via replication.,https://doi.org/10.1016/j.jesp.2015.10.012,Charles R. Ebersole et al. ,"Primary Source, Reading, Paper",College / Upper Division (Undergraduates),"The university participant pool is a key resource for behavioral research, and data quality is believed to vary over the course of the academic semester. This crowdsourced project examined time of semester variation in 10 known effects, 10 individual differences, and 3 data quality indicators over the course of the academic semester in 20 participant pools (N = 2696) and with an online sample (N = 737). Weak time of semester effects were observed on data quality indicators, participant sex, and a few individual differences-conscientiousness, mood, and stress. However, there was little evidence for time of semester qualifying experimental or correlational effects. The generality of this evidence is unknown because only a subset of the tested effects demonstrated evidence for the original result in the whole sample. Mean characteristics of pool samples change slightly during the semester, but these data suggest that those changes are mostly irrelevant for detecting effects.",English,I don't see any of these,Student,"Applied Science, Social Science","Reproducibility and Replicability Knowledge,Replication Research","Reproducibility Crisis and Credibility Revolution,Open Science"
2020-05-28T13:10:35.558Z,Is there a credibility crisis in strategic management research? Evidence on the reproducibility of study findings,https://doi.org/10.1177/1476127017701076,"Donald D Bergh, Barton M Sharp, Herman Aguinis and Ming Li","Primary Source, Reading, Paper",College / Upper Division (Undergraduates),"Recent studies report an inability to replicate previously published research, leading some to suggest that scientific knowledge is facing a credibility crisis. In this essay, we provide evidence on whether strategic management research may itself be vulnerable to these concerns. We conducted a study whereby we attempted to reproduce the empirical findings of 88 articles appearing in the Strategic Management Journal using data reported in the articles themselves. About 70% of the studies did not disclose enough data to permit independent tests of reproducibility of their findings. Of those that could be retested, almost one-third reported hypotheses as statistically significant which were no longer so and far more significant results were found to be non-significant in the reproductions than in the opposite direction. Collectively, incomplete reporting practices, disclosure errors, and possible opportunism limit the reproducibility of most studies. Until disclosure standards and requirements change to include more complete reporting and facilitate tests of reproducibility, the strategic management field appears vulnerable to a credibility crisis.",English,I don't see any of these,Student,"Applied Science, Social Science","Reproducibility and Replicability Knowledge,Reproducible Analyses,Replication Research","Reproducibility Crisis and Credibility Revolution,Open Science"
2020-05-28T13:13:41.155Z,"1,500 scientists lift the lid on reproducibility",https://doi.org/10.1038/533452a,Monya Baker,"Primary Source, Reading, Paper",College / Upper Division (Undergraduates),Survey sheds light on the ‘crisis’ rocking research.,English,I don't see any of these,Student,"Applied Science, Social Science",Reproducibility and Replicability Knowledge,"Reproducibility Crisis and Credibility Revolution,Open Science"
2020-05-28T13:17:09.858Z,Effect size guidelines for individual differences researchers,https://doi.org/10.1016/j.paid.2016.06.069,Gilles E.Gignac and Eva T.Szodorai,"Primary Source, Reading, Paper",College / Upper Division (Undergraduates),"Individual differences researchers very commonly report Pearson correlations between their variables of interest. Cohen (1988) provided guidelines for the purposes of interpreting the magnitude of a correlation, as well as estimating power. Specifically, r = 0.10, r = 0.30, and r = 0.50 were recommended to be considered small, medium, and large in magnitude, respectively. However, Cohen's effect size guidelines were based principally upon an essentially qualitative impression, rather than a systematic, quantitative analysis of data. Consequently, the purpose of this investigation was to develop a large sample of previously published meta-analytically derived correlations which would allow for an evaluation of Cohen's guidelines from an empirical perspective. Based on 708 meta-analytically derived correlations, the 25th, 50th, and 75th percentiles corresponded to correlations of 0.11, 0.19, and 0.29, respectively. Based on the results, it is suggested that Cohen's correlation guidelines are too exigent, as < 3% of correlations in the literature were found to be as large as r = 0.50. Consequently, in the absence of any other information, individual differences researchers are recommended to consider correlations of 0.10, 0.20, and 0.30 as relatively small, typical, and relatively large, in the context of a power analysis, as well as the interpretation of statistical results from a normative perspective.",English,I don't see any of these,Student,Math & Statistics,Conceptual and Statistical Knowledge,
2020-05-28T13:18:50.167Z,"Experiments with More Than One Random Factor: Designs, Analytic Models, and Statistical Power.",https://doi.org/10.1146/annurev-psych-122414-033702,"Judd, C. M., Westfall, J., & Kenny, D. A. ","Primary Source, Reading, Paper",College / Upper Division (Undergraduates),"Traditional methods of analyzing data from psychological experiments are based on the assumption that there is a single random factor (normally participants) to which generalization is sought. However, many studies involve at least two random factors (e.g., participants and the targets to which they respond, such as words, pictures, or individuals). The application of traditional analytic methods to the data from such studies can result in serious bias in testing experimental effects. In this review, we develop a comprehensive typology of designs involving two random factors, which may be either crossed or nested, and one fixed factor, condition. We present appropriate linear mixed models for all designs and develop effect size measures. We provide the tools for power estimation for all designs. We then discuss issues of design choice, highlighting power and feasibility considerations. Our goal is to encourage appropriate analytic methods that produce replicable results for studies involving new samples of both participants and targets.",English,I don't see any of these,Student,Math & Statistics,Conceptual and Statistical Knowledge,
2020-05-28T13:21:15.116Z,Performing high‐powered studies efficiently with sequential analyses,https://doi.org/10.1002/ejsp.2023,Daniel Lakens,"Primary Source, Reading, Paper",College / Upper Division (Undergraduates),"Running studies with high statistical power, while effect size estimates in psychology are often inaccurate, leads to a practical challenge when designing an experiment. This challenge can be addressed by performing sequential analyses while the data collection is still in progress. At an interim analysis, data collection can be stopped whenever the results are convincing enough to conclude that an effect is present, more data can be collected, or the study can be terminated whenever it is extremely unlikely that the predicted effect will be observed if data collection would be continued. Such interim analyses can be performed while controlling the Type 1 error rate. Sequential analyses can greatly improve the efficiency with which data are collected. Additional flexibility is provided by adaptive designs where sample sizes are increased on the basis of the observed effect size. The need for pre‐registration, ways to prevent experimenter bias, and a comparison between Bayesian approaches and null‐hypothesis significance testing (NHST) are discussed. Sequential analyses, which are widely used in large‐scale medical trials, provide an efficient way to perform high‐powered informative experiments. I hope this introduction will provide a practical primer that allows researchers to incorporate sequential analyses in their research. ",English,I don't see any of these,Student,Math & Statistics,Conceptual and Statistical Knowledge,
2020-05-28T13:22:58.221Z,Sample Size Planning for Statistical Power and Accuracy in Parameter Estimation,https://doi.org/10.1146/annurev.psych.59.103006.093735,"Scott E. Maxwell, Ken Kelley and Joseph R. Rausch","Primary Source, Reading, Paper",College / Upper Division (Undergraduates),"This review examines recent advances in sample size planning, not only from the perspective of an individual researcher, but also with regard to the goal of developing cumulative knowledge. Psychologists have traditionally thought of sample size planning in terms of power analysis. Although we review recent advances in power analysis, our main focus is the desirability of achieving accurate parameter estimates, either instead of or in addition to obtaining sufficient power. Accuracy in parameter estimation (AIPE) has taken on increasing importance in light of recent emphasis on effect size estimation and formation of confidence intervals. The review provides an overview of the logic behind sample size planning for AIPE and summarizes recent advances in implementing this approach in designs commonly used in psychological research.",English,I don't see any of these,Student,Math & Statistics,Conceptual and Statistical Knowledge,
2020-05-28T13:24:20.399Z,An assessment of the magnitude of effect sizes: Evidence from 30 years of meta-analysis in management. ,https://doi.org/10.1177/1548051815614321,"Paterson, T. A., Harms, P. D., Steel, P., & Credé, M","Primary Source, Reading, Paper",College / Upper Division (Undergraduates),"This study compiles information from more than 250 meta-analyses conducted over the past 30 years to assess the magnitude of reported effect sizes in the organizational behavior (OB)/human resources (HR) literatures. Our analysis revealed an average uncorrected effect of r = .227 and an average corrected effect of ρ = .278 (SDρ = .140). Based on the distribution of effect sizes we report, Cohen’s effect size benchmarks are not appropriate for use in OB/HR research as they overestimate the actual breakpoints between small, medium, and large effects. We also assessed the average statistical power reported in meta-analytic conclusions and found substantial evidence that the majority of primary studies in the management literature are statistically underpowered. Finally, we investigated the impact of the file drawer problem in meta-analyses and our findings indicate that the file drawer problem is not a significant concern for meta-analysts. We conclude by discussing various implications of this study for OB/HR researchers.",English,I don't see any of these,Student,Math & Statistics,Conceptual and Statistical Knowledge,
2020-05-28T13:32:15.023Z,Small telescopes Detectability and the evaluation of replication results. ,https://doi.org/10.1177/0956797614567341,Uri Simonsohn,"Primary Source, Reading, Paper",College / Upper Division (Undergraduates),"This article introduces a new approach for evaluating replication results. It combines effect-size estimation with hypothesis testing, assessing the extent to which the replication results are consistent with an effect size big enough to have been detectable in the original study. The approach is demonstrated by examining replications of three well-known findings. Its benefits include the following: (a) differentiating “unsuccessful” replication attempts (i.e., studies yielding p > .05) that are too noisy from those that actively indicate the effect is undetectably different from zero, (b) “protecting” true findings from underpowered replications, and (c) arriving at intuitively compelling inferences in general and for the revisited replications in particular",English,I don't see any of these,Student,"Applied Science, Math & Statistics, Social Science","Reproducibility and Replicability Knowledge,Conceptual and Statistical Knowledge,Reproducible Analyses,Replication Research","Reproducibility Crisis and Credibility Revolution,Open Science"
2020-05-28T13:35:28.546Z,At what sample size do correlations stabilize? ,https://doi.org/10.1016/j.jrp.2013.05.009,Felix D. Schonbrodt and Marco Perugini,"Primary Source, Reading, Paper",College / Upper Division (Undergraduates),"Sample correlations converge to the population value with increasing sample size, but the estimates are often inaccurate in small samples. In this report we use Monte-Carlo simulations to determine the critical sample size from which on the magnitude of a correlation can be expected to be stable. The necessary sample size to achieve stable estimates for correlations depends on the effect size, the width of the corridor of stability (i.e., a corridor around the true value where deviations are tolerated), and the requested confidence that the trajectory does not leave this corridor any more. Results indicate that in typical scenarios the sample size should approach 250 for stable estimates.",English,I don't see any of these,Student,Math & Statistics,Conceptual and Statistical Knowledge,
2020-05-28T13:37:27.140Z,Effect Size Estimation in Neuroimaging. ,https://doi.org/10.1001/jamapsychiatry.2016.3356,"Marianne C. Reddan, Martin A. Lindquist and Tor D. Wager","Primary Source, Reading, Paper",College / Upper Division (Undergraduates),"A central goal of translational neuroimaging is to establish robust links between brain measures and clinical outcomes. Success hinges on the development of brain biomarkers with large effect sizes. With large enough effects, a measure may be diagnostic of outcomes at the individual patient level. Surprisingly, however, standard brain-mapping analyses are not designed to estimate or optimize the effect sizes of brain-outcome relationships, and estimates are often biased. Here, we review these issues and how to estimate effect sizes in neuroimaging research.",English,I don't see any of these,Student,Math & Statistics,Conceptual and Statistical Knowledge,
2020-05-28T13:40:20.741Z,Scanning the horizon: towards transparent and reproducible neuroimaging research,https://doi.org/10.1038/nrn.2016.167,"Russell A. Poldrack, Chris I. Baker, Joke Durnez, Krzysztof J. Gorgolewski, Paul M. Matthews, Marcus R. Munafò, Thomas E. Nichols, Jean-Baptiste Poline, Edward Vul & Tal Yarkoni ","Primary Source, Reading, Paper",College / Upper Division (Undergraduates),"Functional neuroimaging techniques have transformed our ability to probe the neurobiological basis of behaviour and are increasingly being applied by the wider neuroscience community. However, concerns have recently been raised that the conclusions that are drawn from some human neuroimaging studies are either spurious or not generalizable. Problems such as low statistical power, flexibility in data analysis, software errors and a lack of direct replication apply to many fields, but perhaps particularly to functional MRI. Here, we discuss these problems, outline current and suggested best practices, and describe how we think the field should evolve to produce the most meaningful and reliable answers to neuroscientific questions.",English,I don't see any of these,Student,Life Science,"Reproducibility and Replicability Knowledge,Replication Research","Reproducibility Crisis and Credibility Revolution,Open Science"
